Topic,Topic Name,Rationality,Interactivity,Equality,Civility,Common good reference,Constructiveness
0,"Anonymity and its impact on online vs offline conversations, with a focus on Reddit",Irrelevant,Relevant,Irrelevant,Relevant,Irrelevant,Irrelevant
1,Discussion on the rules of an online community,Relevant,Irrelevant,Irrelevant,Relevant,Relevant,Irrelevant
2,The Role of AI in Moderation and the Future of Human Moderators,Relevant,Irrelevant,Irrelevant,Irrelevant,Irrelevant,Irrelevant
3,Moderating the Mod Queue and Mod Mail,Relevant,Irrelevant,Irrelevant,Relevant,Relevant,Irrelevant
4,Free Speech and Government Limitations,Irrelevant,Irrelevant,Relevant,Relevant,Irrelevant,Irrelevant
5,The Importance of Moderation in Online Communities,Irrelevant,Relevant,Irrelevant,Relevant,Irrelevant,Irrelevant
6,Reddit Moderator Hierarchy,Irrelevant,Irrelevant,Irrelevant,Irrelevant,Irrelevant,Irrelevant
7,Controversial subreddit and the presence of women and trans people,Irrelevant,Irrelevant,Relevant,Relevant,Irrelevant,Irrelevant
8,Moderation and its role in reducing harm and improving quality,Relevant,Irrelevant,Irrelevant,Relevant,Irrelevant,Relevant
9,Bot and Auto Moderator Usage on Reddit,Irrelevant,Irrelevant,Irrelevant,Relevant,Irrelevant,Irrelevant
10,The Need for More Online Moderation and Consequences,Irrelevant,Irrelevant,Irrelevant,Relevant,Irrelevant,Irrelevant
11,Dangers of Online Communities and Social Media Platforms,Irrelevant,Relevant,Irrelevant,Relevant,Relevant,Relevant
12,Civil and open political discussions within a community,Relevant,Relevant,Irrelevant,Relevant,Relevant,Relevant
13,Moderators' communication and decision-making process,Irrelevant,Irrelevant,Irrelevant,Irrelevant,Irrelevant,Irrelevant
14,Moderating to Improve the Sub,Relevant,Irrelevant,Irrelevant,Relevant,Relevant,Irrelevant
15,Bans and consequences,Irrelevant,Irrelevant,Irrelevant,Relevant,Irrelevant,Relevant
16,Defining High-Quality Content in Online Communities,Relevant,Relevant,Irrelevant,Irrelevant,Irrelevant,Irrelevant
17,Rules and moderators in a subreddit,Relevant,Irrelevant,Irrelevant,Relevant,Irrelevant,Irrelevant
18,Rediquette and its influence on Reddit behavior,Irrelevant,Irrelevant,Relevant,Relevant,Irrelevant,Irrelevant
19,Subreddit and Comments Analysis,Irrelevant,Irrelevant,Irrelevant,Irrelevant,Irrelevant,Irrelevant
20,Dealing with arguing in bad faith in moderating political comments,Relevant,Irrelevant,Irrelevant,Irrelevant,Irrelevant,Irrelevant
21,Moderators removing posts and enforcing rules,Irrelevant,Irrelevant,Irrelevant,Irrelevant,Irrelevant,Irrelevant
22,Opportunities for improving online discussion,Relevant,Irrelevant,Irrelevant,Irrelevant,Irrelevant,Irrelevant
23,Mod List and Moderation in Subreddits,Irrelevant,Irrelevant,Irrelevant,Irrelevant,Irrelevant,Irrelevant
24,Moderation and its Role in Community Management,Relevant,Irrelevant,Irrelevant,Irrelevant,Relevant,Irrelevant
25,Moderation Challenges in an Online Community,Relevant,Irrelevant,Irrelevant,Relevant,Irrelevant,Irrelevant
